{"condition": "baseline", "exp": 1, "description": "HEAD_DIM=48 (was 128) [random perturbation]", "old_line": "HEAD_DIM = 128          # target head dimension for attention", "new_line": "HEAD_DIM = 48          # target head dimension for attention", "status": "discard", "val_bpb": 1.424111, "vram_gb": 11.8, "wall_seconds": 385.5, "timestamp": "2026-03-29 09:45:36"}
{"condition": "baseline", "exp": 2, "description": "EMBEDDING_LR=1.5 (was 0.6) [random perturbation]", "old_line": "EMBEDDING_LR = 0.6      # learning rate for token embeddings (Adam)", "new_line": "EMBEDDING_LR = 1.5      # learning rate for token embeddings (Adam)", "status": "discard", "val_bpb": 1.291191, "vram_gb": 11.4, "wall_seconds": 371.2, "timestamp": "2026-03-29 09:51:47"}
{"condition": "baseline", "exp": 3, "description": "SCALAR_LR=0.4 (was 0.5) [random perturbation]", "old_line": "SCALAR_LR = 0.5         # learning rate for per-layer scalars (Adam)", "new_line": "SCALAR_LR = 0.4         # learning rate for per-layer scalars (Adam)", "status": "keep", "val_bpb": 1.242391, "vram_gb": 11.4, "wall_seconds": 371.2, "timestamp": "2026-03-29 09:57:58"}
{"condition": "baseline", "exp": 4, "description": "TOTAL_BATCH_SIZE=2**17 (was 2**19) [random perturbation]", "old_line": "TOTAL_BATCH_SIZE = 2**19 # ~524K tokens per optimizer step", "new_line": "TOTAL_BATCH_SIZE = 2**17 # ~524K tokens per optimizer step", "status": "keep", "val_bpb": 1.188727, "vram_gb": 11.4, "wall_seconds": 351.6, "timestamp": "2026-03-29 10:03:50"}
{"condition": "baseline", "exp": 5, "description": "HEAD_DIM=96 (was 128) [random perturbation]", "old_line": "HEAD_DIM = 128          # target head dimension for attention", "new_line": "HEAD_DIM = 96          # target head dimension for attention", "status": "discard", "val_bpb": 1.211778, "vram_gb": 12.8, "wall_seconds": 362.6, "timestamp": "2026-03-29 10:09:52"}
{"condition": "baseline", "exp": 6, "description": "DEPTH=4 (was 8) [random perturbation]", "old_line": "DEPTH = 8               # number of transformer layers", "new_line": "DEPTH = 4               # number of transformer layers", "status": "keep", "val_bpb": 1.171096, "vram_gb": 3.6, "wall_seconds": 325.6, "timestamp": "2026-03-29 10:15:18"}
{"condition": "baseline", "exp": 7, "description": "ASPECT_RATIO=96 (was 64) [random perturbation]", "old_line": "ASPECT_RATIO = 64       # model_dim = depth * ASPECT_RATIO", "new_line": "ASPECT_RATIO = 96       # model_dim = depth * ASPECT_RATIO", "status": "keep", "val_bpb": 1.154699, "vram_gb": 5.0, "wall_seconds": 329.9, "timestamp": "2026-03-29 10:20:48"}
{"condition": "baseline", "exp": 8, "description": "EMBEDDING_LR=0.2 (was 0.6) [random perturbation]", "old_line": "EMBEDDING_LR = 0.6      # learning rate for token embeddings (Adam)", "new_line": "EMBEDDING_LR = 0.2      # learning rate for token embeddings (Adam)", "status": "discard", "val_bpb": 1.157078, "vram_gb": 5.0, "wall_seconds": 329.0, "timestamp": "2026-03-29 10:26:17"}
{"condition": "baseline", "exp": 9, "description": "SCALAR_LR=0.4 (was 0.4) [random perturbation]", "old_line": "SCALAR_LR = 0.4         # learning rate for per-layer scalars (Adam)", "new_line": "SCALAR_LR = 0.4         # learning rate for per-layer scalars (Adam)", "status": "keep", "val_bpb": 1.153562, "vram_gb": 5.0, "wall_seconds": 329.2, "timestamp": "2026-03-29 10:31:46"}
{"condition": "baseline", "exp": 10, "description": "ASPECT_RATIO=32 (was 96) [random perturbation]", "old_line": "ASPECT_RATIO = 96       # model_dim = depth * ASPECT_RATIO", "new_line": "ASPECT_RATIO = 32       # model_dim = depth * ASPECT_RATIO", "status": "discard", "val_bpb": 1.250442, "vram_gb": 2.3, "wall_seconds": 322.0, "timestamp": "2026-03-29 10:37:08"}
{"condition": "baseline", "exp": 11, "description": "DEPTH=8 (was 4) [random perturbation]", "old_line": "DEPTH = 4               # number of transformer layers", "new_line": "DEPTH = 8               # number of transformer layers", "status": "discard", "val_bpb": 1.23939, "vram_gb": 16.9, "wall_seconds": 380.3, "timestamp": "2026-03-29 10:43:29"}
{"condition": "baseline", "exp": 12, "description": "TOTAL_BATCH_SIZE=2**19 (was 2**17) [random perturbation]", "old_line": "TOTAL_BATCH_SIZE = 2**17 # ~524K tokens per optimizer step", "new_line": "TOTAL_BATCH_SIZE = 2**19 # ~524K tokens per optimizer step", "status": "discard", "val_bpb": 1.197125, "vram_gb": 5.0, "wall_seconds": 336.4, "timestamp": "2026-03-29 10:49:05"}
{"condition": "baseline", "exp": 13, "description": "SCALAR_LR=0.7 (was 0.4) [random perturbation]", "old_line": "SCALAR_LR = 0.4         # learning rate for per-layer scalars (Adam)", "new_line": "SCALAR_LR = 0.7         # learning rate for per-layer scalars (Adam)", "status": "discard", "val_bpb": 1.153699, "vram_gb": 5.0, "wall_seconds": 329.0, "timestamp": "2026-03-29 10:54:34"}
{"condition": "baseline", "exp": 14, "description": "WEIGHT_DECAY=0.33 (was 0.2) [random perturbation]", "old_line": "WEIGHT_DECAY = 0.2      # cautious weight decay for Muon", "new_line": "WEIGHT_DECAY = 0.33      # cautious weight decay for Muon", "status": "discard", "val_bpb": 1.156579, "vram_gb": 5.0, "wall_seconds": 329.6, "timestamp": "2026-03-29 11:00:04"}
{"condition": "baseline", "exp": 15, "description": "EMBEDDING_LR=1.5 (was 0.6) [random perturbation]", "old_line": "EMBEDDING_LR = 0.6      # learning rate for token embeddings (Adam)", "new_line": "EMBEDDING_LR = 1.5      # learning rate for token embeddings (Adam)", "status": "keep", "val_bpb": 1.152377, "vram_gb": 5.0, "wall_seconds": 329.2, "timestamp": "2026-03-29 11:05:33"}
{"condition": "baseline", "exp": 16, "description": "MATRIX_LR=0.09 (was 0.04) [random perturbation]", "old_line": "MATRIX_LR = 0.04        # learning rate for matrix parameters (Muon)", "new_line": "MATRIX_LR = 0.09        # learning rate for matrix parameters (Muon)", "status": "discard", "val_bpb": 1.162807, "vram_gb": 5.0, "wall_seconds": 329.3, "timestamp": "2026-03-29 11:11:03"}
{"condition": "baseline", "exp": 17, "description": "WARMUP_RATIO=0.08 (was 0.0) [random perturbation]", "old_line": "WARMUP_RATIO = 0.0      # fraction of time budget for LR warmup", "new_line": "WARMUP_RATIO = 0.08      # fraction of time budget for LR warmup", "status": "discard", "val_bpb": 1.156033, "vram_gb": 5.0, "wall_seconds": 329.5, "timestamp": "2026-03-29 11:16:32"}
{"condition": "baseline", "exp": 18, "description": "SCALAR_LR=1.4 (was 0.4) [random perturbation]", "old_line": "SCALAR_LR = 0.4         # learning rate for per-layer scalars (Adam)", "new_line": "SCALAR_LR = 1.4         # learning rate for per-layer scalars (Adam)", "status": "discard", "val_bpb": 1.155746, "vram_gb": 5.0, "wall_seconds": 329.5, "timestamp": "2026-03-29 11:22:02"}
{"condition": "baseline", "exp": 19, "description": "WARMUP_RATIO=0.03 (was 0.0) [random perturbation]", "old_line": "WARMUP_RATIO = 0.0      # fraction of time budget for LR warmup", "new_line": "WARMUP_RATIO = 0.03      # fraction of time budget for LR warmup", "status": "discard", "val_bpb": 1.155885, "vram_gb": 5.0, "wall_seconds": 329.7, "timestamp": "2026-03-29 11:27:32"}
{"condition": "baseline", "exp": 20, "description": "WARMDOWN_RATIO=0.3 (was 0.5) [random perturbation]", "old_line": "WARMDOWN_RATIO = 0.5    # fraction of time budget for LR warmdown", "new_line": "WARMDOWN_RATIO = 0.3    # fraction of time budget for LR warmdown", "status": "discard", "val_bpb": 1.156209, "vram_gb": 5.0, "wall_seconds": 329.4, "timestamp": "2026-03-29 11:33:01"}
{"condition": "baseline", "exp": 21, "description": "ADAM_BETAS=(0.79, 0.926) (was (0.8, 0.95)) [random perturbation]", "old_line": "ADAM_BETAS = (0.8, 0.95) # Adam beta1, beta2", "new_line": "ADAM_BETAS = (0.79, 0.926) # Adam beta1, beta2", "status": "discard", "val_bpb": 1.152584, "vram_gb": 5.0, "wall_seconds": 330.0, "timestamp": "2026-03-29 11:38:31"}
{"condition": "baseline", "exp": 22, "description": "EMBEDDING_LR=1.5 (was 1.5) [random perturbation]", "old_line": "EMBEDDING_LR = 1.5      # learning rate for token embeddings (Adam)", "new_line": "EMBEDDING_LR = 1.5      # learning rate for token embeddings (Adam)", "status": "discard", "val_bpb": 1.15238, "vram_gb": 5.0, "wall_seconds": 329.5, "timestamp": "2026-03-29 11:44:01"}
{"condition": "baseline", "exp": 23, "description": "DEPTH=6 (was 4) [random perturbation]", "old_line": "DEPTH = 4               # number of transformer layers", "new_line": "DEPTH = 6               # number of transformer layers", "status": "discard", "val_bpb": 1.195492, "vram_gb": 10.9, "wall_seconds": 355.5, "timestamp": "2026-03-29 11:49:56"}
{"condition": "baseline", "exp": 24, "description": "WARMDOWN_RATIO=0.3 (was 0.5) [random perturbation]", "old_line": "WARMDOWN_RATIO = 0.5    # fraction of time budget for LR warmdown", "new_line": "WARMDOWN_RATIO = 0.3    # fraction of time budget for LR warmdown", "status": "discard", "val_bpb": 1.15643, "vram_gb": 5.0, "wall_seconds": 329.8, "timestamp": "2026-03-29 11:55:26"}
{"condition": "baseline", "exp": 25, "description": "WEIGHT_DECAY=0.33 (was 0.2) [random perturbation]", "old_line": "WEIGHT_DECAY = 0.2      # cautious weight decay for Muon", "new_line": "WEIGHT_DECAY = 0.33      # cautious weight decay for Muon", "status": "discard", "val_bpb": 1.157851, "vram_gb": 5.0, "wall_seconds": 329.3, "timestamp": "2026-03-29 12:00:55"}
{"condition": "baseline", "exp": 26, "description": "ASPECT_RATIO=64 (was 96) [random perturbation]", "old_line": "ASPECT_RATIO = 96       # model_dim = depth * ASPECT_RATIO", "new_line": "ASPECT_RATIO = 64       # model_dim = depth * ASPECT_RATIO", "status": "discard", "val_bpb": 1.169485, "vram_gb": 3.6, "wall_seconds": 324.9, "timestamp": "2026-03-29 12:06:20"}
{"condition": "baseline", "exp": 27, "description": "ASPECT_RATIO=48 (was 96) [random perturbation]", "old_line": "ASPECT_RATIO = 96       # model_dim = depth * ASPECT_RATIO", "new_line": "ASPECT_RATIO = 48       # model_dim = depth * ASPECT_RATIO", "status": "discard", "val_bpb": 1.170625, "vram_gb": 3.6, "wall_seconds": 324.9, "timestamp": "2026-03-29 12:11:45"}
{"condition": "baseline", "exp": 28, "description": "TOTAL_BATCH_SIZE=2**18 (was 2**17) [random perturbation]", "old_line": "TOTAL_BATCH_SIZE = 2**17 # ~524K tokens per optimizer step", "new_line": "TOTAL_BATCH_SIZE = 2**18 # ~524K tokens per optimizer step", "status": "discard", "val_bpb": 1.207016, "vram_gb": 5.0, "wall_seconds": 331.5, "timestamp": "2026-03-29 12:17:17"}
{"condition": "baseline", "exp": 29, "description": "EMBEDDING_LR=1.4 (was 1.5) [random perturbation]", "old_line": "EMBEDDING_LR = 1.5      # learning rate for token embeddings (Adam)", "new_line": "EMBEDDING_LR = 1.4      # learning rate for token embeddings (Adam)", "status": "discard", "val_bpb": 1.15405, "vram_gb": 5.0, "wall_seconds": 329.3, "timestamp": "2026-03-29 12:22:46"}
{"condition": "baseline", "exp": 30, "description": "WINDOW_PATTERN=\"LLLL\" (was \"SSSL\") [random perturbation]", "old_line": "WINDOW_PATTERN = \"SSSL\" # sliding window pattern: L=full, S=half context", "new_line": "WINDOW_PATTERN = \"LLLL\" # sliding window pattern: L=full, S=half context", "status": "keep", "val_bpb": 1.152082, "vram_gb": 5.0, "wall_seconds": 329.8, "timestamp": "2026-03-29 12:28:16"}
{"condition": "baseline", "exp": 31, "description": "UNEMBEDDING_LR=0.0173 (was 0.004) [random perturbation]", "old_line": "UNEMBEDDING_LR = 0.004  # learning rate for lm_head (Adam)", "new_line": "UNEMBEDDING_LR = 0.0173  # learning rate for lm_head (Adam)", "status": "discard", "val_bpb": 1.155005, "vram_gb": 5.0, "wall_seconds": 329.5, "timestamp": "2026-03-29 12:33:46"}
{"condition": "baseline", "exp": 32, "description": "ADAM_BETAS=(0.73, 0.928) (was (0.8, 0.95)) [random perturbation]", "old_line": "ADAM_BETAS = (0.8, 0.95) # Adam beta1, beta2", "new_line": "ADAM_BETAS = (0.73, 0.928) # Adam beta1, beta2", "status": "discard", "val_bpb": 1.153242, "vram_gb": 5.0, "wall_seconds": 329.5, "timestamp": "2026-03-29 12:39:15"}
{"condition": "baseline", "exp": 33, "description": "HEAD_DIM=64 (was 128) [random perturbation]", "old_line": "HEAD_DIM = 128          # target head dimension for attention", "new_line": "HEAD_DIM = 64          # target head dimension for attention", "status": "discard", "val_bpb": 1.15786, "vram_gb": 5.0, "wall_seconds": 340.7, "timestamp": "2026-03-29 12:44:56"}
{"condition": "baseline", "exp": 34, "description": "MATRIX_LR=0.05 (was 0.04) [random perturbation]", "old_line": "MATRIX_LR = 0.04        # learning rate for matrix parameters (Muon)", "new_line": "MATRIX_LR = 0.05        # learning rate for matrix parameters (Muon)", "status": "discard", "val_bpb": 1.153568, "vram_gb": 5.0, "wall_seconds": 329.7, "timestamp": "2026-03-29 12:50:26"}
{"condition": "baseline", "exp": 35, "description": "SCALAR_LR=1.0 (was 0.4) [random perturbation]", "old_line": "SCALAR_LR = 0.4         # learning rate for per-layer scalars (Adam)", "new_line": "SCALAR_LR = 1.0         # learning rate for per-layer scalars (Adam)", "status": "discard", "val_bpb": 1.157858, "vram_gb": 5.0, "wall_seconds": 329.6, "timestamp": "2026-03-29 12:55:55"}
{"condition": "baseline", "exp": 36, "description": "TOTAL_BATCH_SIZE=2**18 (was 2**17) [random perturbation]", "old_line": "TOTAL_BATCH_SIZE = 2**17 # ~524K tokens per optimizer step", "new_line": "TOTAL_BATCH_SIZE = 2**18 # ~524K tokens per optimizer step", "status": "discard", "val_bpb": 1.205796, "vram_gb": 5.0, "wall_seconds": 331.9, "timestamp": "2026-03-29 13:01:27"}
{"condition": "baseline", "exp": 37, "description": "ASPECT_RATIO=48 (was 96) [random perturbation]", "old_line": "ASPECT_RATIO = 96       # model_dim = depth * ASPECT_RATIO", "new_line": "ASPECT_RATIO = 48       # model_dim = depth * ASPECT_RATIO", "status": "discard", "val_bpb": 1.170516, "vram_gb": 3.6, "wall_seconds": 324.7, "timestamp": "2026-03-29 13:06:52"}
{"condition": "baseline", "exp": 38, "description": "DEPTH=8 (was 4) [random perturbation]", "old_line": "DEPTH = 4               # number of transformer layers", "new_line": "DEPTH = 8               # number of transformer layers", "status": "discard", "val_bpb": 1.241046, "vram_gb": 16.9, "wall_seconds": 379.0, "timestamp": "2026-03-29 13:13:11"}
{"condition": "baseline", "exp": 39, "description": "MATRIX_LR=0.06 (was 0.04) [random perturbation]", "old_line": "MATRIX_LR = 0.04        # learning rate for matrix parameters (Muon)", "new_line": "MATRIX_LR = 0.06        # learning rate for matrix parameters (Muon)", "status": "discard", "val_bpb": 1.15592, "vram_gb": 5.0, "wall_seconds": 329.1, "timestamp": "2026-03-29 13:18:40"}
{"condition": "baseline", "exp": 40, "description": "WEIGHT_DECAY=0.40 (was 0.2) [random perturbation]", "old_line": "WEIGHT_DECAY = 0.2      # cautious weight decay for Muon", "new_line": "WEIGHT_DECAY = 0.40      # cautious weight decay for Muon", "status": "discard", "val_bpb": 1.160047, "vram_gb": 5.0, "wall_seconds": 329.1, "timestamp": "2026-03-29 13:24:10"}
{"condition": "baseline", "exp": 41, "description": "HEAD_DIM=96 (was 128) [random perturbation]", "old_line": "HEAD_DIM = 128          # target head dimension for attention", "new_line": "HEAD_DIM = 96          # target head dimension for attention", "status": "discard", "val_bpb": 1.157689, "vram_gb": 5.0, "wall_seconds": 338.2, "timestamp": "2026-03-29 13:29:48"}
{"condition": "baseline", "exp": 42, "description": "DEPTH=8 (was 4) [random perturbation]", "old_line": "DEPTH = 4               # number of transformer layers", "new_line": "DEPTH = 8               # number of transformer layers", "status": "discard", "val_bpb": 1.242042, "vram_gb": 16.9, "wall_seconds": 379.2, "timestamp": "2026-03-29 13:36:07"}
{"condition": "baseline", "exp": 43, "description": "HEAD_DIM=64 (was 128) [random perturbation]", "old_line": "HEAD_DIM = 128          # target head dimension for attention", "new_line": "HEAD_DIM = 64          # target head dimension for attention", "status": "discard", "val_bpb": 1.156835, "vram_gb": 5.0, "wall_seconds": 329.9, "timestamp": "2026-03-29 13:41:37"}
{"condition": "baseline", "exp": 44, "description": "ADAM_BETAS=(0.89, 0.906) (was (0.8, 0.95)) [random perturbation]", "old_line": "ADAM_BETAS = (0.8, 0.95) # Adam beta1, beta2", "new_line": "ADAM_BETAS = (0.89, 0.906) # Adam beta1, beta2", "status": "discard", "val_bpb": 1.158495, "vram_gb": 5.0, "wall_seconds": 329.3, "timestamp": "2026-03-29 13:47:07"}
{"condition": "baseline", "exp": 45, "description": "ADAM_BETAS=(0.71, 0.931) (was (0.8, 0.95)) [random perturbation]", "old_line": "ADAM_BETAS = (0.8, 0.95) # Adam beta1, beta2", "new_line": "ADAM_BETAS = (0.71, 0.931) # Adam beta1, beta2", "status": "discard", "val_bpb": 1.153249, "vram_gb": 5.0, "wall_seconds": 329.9, "timestamp": "2026-03-29 13:52:37"}
{"condition": "baseline", "event": "stopped", "reason": "consecutive_discards (15 >= 15)", "total_experiments": 45, "best_bpb": 1.152082, "total_wall_seconds": 15206.5, "timestamp": "2026-03-29 13:52:37"}
