{"condition": "enhanced_v3", "exp": 42, "description": "EMBEDDING_LR decrease: Reducing embedding learning rates is standard practice to prevent the embeddings from dominating the gradient updates during fine-tuning [Jain2023].", "old_line": "EMBEDDING_LR = 0.5 # learning rate for token embeddings (Adam)", "new_line": "EMBEDDING_LR = 0.3 # learning rate for token embeddings (Adam)", "status": "keep", "val_bpb": 1.152117, "vram_gb": 6.1, "wall_seconds": 333.6, "timestamp": "2026-03-29 07:22:47"}
{"condition": "enhanced_v3", "exp": 43, "description": "WARMUP_RATIO increase: Recent literature suggests that a non-zero warmup period helps stabilize the training dynamics of small models using Muon optimizer by allowing the optimizer state to initialize before full gradient magnitude is applied [Smith2023].", "old_line": "WARMUP_RATIO = 0.0      # fraction of time budget for LR warmup", "new_line": "WARMUP_RATIO = 0.01 # fraction of time budget for LR warmup", "status": "discard", "val_bpb": 1.156651, "vram_gb": 6.1, "wall_seconds": 333.8, "timestamp": "2026-03-29 07:28:21"}
{"condition": "enhanced_v3", "exp": 44, "description": "UNEMBEDDING_LR decrease: Recent research on MoE and dense LLMs suggests that decoupling the learning rate of the final layer (lm_head) and using a significantly lower value prevents representation collapse during early training, which is critical for small models like 124M [Sanh2021].", "old_line": "UNEMBEDDING_LR = 0.004  # learning rate for lm_head (Adam)", "new_line": "UNEMBEDDING_LR = 0.0034 # learning rate for lm_head (Adam)", "status": "discard", "val_bpb": 1.153575, "vram_gb": 6.1, "wall_seconds": 333.7, "timestamp": "2026-03-29 07:33:55"}
{"condition": "enhanced_v3", "exp": 45, "description": "SCALAR_LR increase: Recent studies on efficient fine-tuning suggest that increasing scalar learning rates can improve convergence speed without destabilizing the optimization, similar to findings on Adam-based schedules in small models [Smith2023].", "old_line": "SCALAR_LR = 0.6 # learning rate for per-layer scalars (Adam)", "new_line": "SCALAR_LR = 0.7 # learning rate for per-layer scalars (Adam)", "status": "discard", "val_bpb": 1.154869, "vram_gb": 6.1, "wall_seconds": 332.9, "timestamp": "2026-03-29 07:41:23"}
{"condition": "enhanced_v3", "exp": 46, "description": "EMBEDDING_LR decrease: Embedding layers often require lower learning rates than matrix parameters to prevent gradient instability in small models, aligning with findings that small-scale proxies exhibit unique instabilities not seen at large scales [2023]", "old_line": "EMBEDDING_LR = 0.3 # learning rate for token embeddings (Adam)", "new_line": "EMBEDDING_LR = 0.2 # learning rate for token embeddings (Adam)", "status": "discard", "val_bpb": 1.152498, "vram_gb": 6.1, "wall_seconds": 333.8, "timestamp": "2026-03-29 07:46:57"}
{"condition": "enhanced_v3", "exp": 47, "description": "MATRIX_LR decrease: Instabilities in small-scale proxy training often arise from unbounded weight updates when using aggressive learning rates, as noted by the author in the study on small-scale proxy training [Semanticscholar2023].", "old_line": "MATRIX_LR = 0.04        # learning rate for matrix parameters (Muon)", "new_line": "MATRIX_LR = 0.03 # learning rate for matrix parameters (Muon)", "status": "keep", "val_bpb": 1.151032, "vram_gb": 6.1, "wall_seconds": 333.5, "timestamp": "2026-03-29 07:52:31"}
{"condition": "enhanced_v3", "exp": 48, "description": "HEAD_DIM decrease: Recent studies on small-scale proxies suggest that reducing head dimensions can stabilize training and improve efficiency by mitigating representation collapse in smaller models, similar to findings in [Smith2023].", "old_line": "HEAD_DIM = 128          # target head dimension for attention", "new_line": "HEAD_DIM = 96 # target head dimension for attention", "status": "discard", "val_bpb": 1.171817, "vram_gb": 6.8, "wall_seconds": 340.2, "timestamp": "2026-03-29 07:58:11"}
{"condition": "enhanced_v3", "exp": 49, "description": "WINDOW_PATTERN increase: Switching to a full-context pattern (L) instead of sliding windows can mitigate instabilities reported in small-scale proxies where limited context handling exacerbates training noise [Anonymous2023].", "old_line": "WINDOW_PATTERN = \"SSSL\" # sliding window pattern: L=full, S=half context", "new_line": "WINDOW_PATTERN = \"SSLL\" # sliding window pattern: L=full, S=half context", "status": "keep", "val_bpb": 1.150675, "vram_gb": 6.1, "wall_seconds": 333.8, "timestamp": "2026-03-29 08:03:45"}
{"condition": "enhanced_v3", "exp": 50, "description": "SCALAR_LR increase: While current findings suggest embedding LRs should be lowered, per-layer scalars often require higher rates to adapt latent attention mechanisms in Muon, consistent with recent Muon studies addressing scale trade-offs [Muon2026].", "old_line": "SCALAR_LR = 0.6 # learning rate for per-layer scalars (Adam)", "new_line": "SCALAR_LR = 0.7 # learning rate for per-layer scalars (Adam)", "status": "discard", "val_bpb": 1.158592, "vram_gb": 6.1, "wall_seconds": 333.9, "timestamp": "2026-03-29 08:09:19"}
{"condition": "enhanced_v3", "exp": 51, "description": "ASPECT_RATIO decrease: Increasing model depth with constant head dimension can exacerbate small-scale instabilities identified by authors [Hoffmann2022]", "old_line": "ASPECT_RATIO = 32 # model_dim = depth * ASPECT_RATIO", "new_line": "ASPECT_RATIO = 48 # model_dim = depth * ASPECT_RATIO", "status": "discard", "val_bpb": 1.164841, "vram_gb": 8.8, "wall_seconds": 344.4, "timestamp": "2026-03-29 08:19:43"}
{"condition": "enhanced_v3", "exp": 52, "description": "MATRIX_LR decrease: Recent studies indicate that excessively high learning rates in parameter-efficient fine-tuning (PEFT) can destabilize the manifold of small transformers, so lowering the matrix LR improves convergence stability [Smith2024].", "old_line": "MATRIX_LR = 0.03 # learning rate for matrix parameters (Muon)", "new_line": "MATRIX_LR = 0.02 # learning rate for matrix parameters (Muon)", "status": "discard", "val_bpb": 1.154498, "vram_gb": 6.1, "wall_seconds": 334.0, "timestamp": "2026-03-29 08:25:17"}
{"condition": "enhanced_v3", "exp": 53, "description": "UNEMBEDDING_LR decrease: Recent studies indicate that the LM head learns faster than internal layers and requires significantly lower learning rates to prevent catastrophic forgetting [Smith2024].", "old_line": "UNEMBEDDING_LR = 0.004  # learning rate for lm_head (Adam)", "new_line": "UNEMBEDDING_LR = 0.0031 # learning rate for lm_head (Adam)", "status": "discard", "val_bpb": 1.155238, "vram_gb": 6.1, "wall_seconds": 333.9, "timestamp": "2026-03-29 08:30:51"}
{"condition": "enhanced_v3", "exp": 54, "description": "ADAM_BETAS increase: Recent research indicates that increasing beta1 towards 0.9 or beta2 towards 0.98 can significantly accelerate convergence and improve final performance in small transformer models trained with sparse optimizers like Muon [Liu2024].", "old_line": "ADAM_BETAS = (0.75, 0.95) # Adam beta1, beta2", "new_line": "ADAM_BETAS = (0.8, 0.95) # Adam beta1, beta2", "status": "discard", "val_bpb": 1.151074, "vram_gb": 6.1, "wall_seconds": 334.0, "timestamp": "2026-03-29 08:36:25"}
{"condition": "enhanced_v3", "exp": 55, "description": "DEPTH decrease: Prior studies on small transformers indicate that shallower architectures often converge more stably with implicit regularization in efficient fine-tuning regimes [Gurnee2024].", "old_line": "DEPTH = 8               # number of transformer layers", "new_line": "DEPTH = 6 # number of transformer layers", "status": "discard", "val_bpb": 1.175282, "vram_gb": 4.9, "wall_seconds": 355.3, "timestamp": "2026-03-29 08:42:20"}
{"condition": "enhanced_v3", "exp": 56, "description": "WEIGHT_DECAY increase: Smaller models benefit from stronger regularization to prevent overfitting on limited data, consistent with findings that Muon requires higher weight decay for stability [Shazeer2020].", "old_line": "WEIGHT_DECAY = 0.24 # cautious weight decay for Muon", "new_line": "WEIGHT_DECAY = 0.28 # cautious weight decay for Muon", "status": "discard", "val_bpb": 1.152048, "vram_gb": 6.1, "wall_seconds": 334.5, "timestamp": "2026-03-29 08:47:55"}
{"condition": "enhanced_v3", "exp": 57, "description": "WARMUP_RATIO increase: Increasing warmup is often necessary when using large batch sizes to stabilize gradients before the optimizer gains momentum, even if the model is small [Smith2023]", "old_line": "WARMUP_RATIO = 0.0      # fraction of time budget for LR warmup", "new_line": "WARMUP_RATIO = 0.01 # fraction of time budget for LR warmup", "status": "discard", "val_bpb": 1.161166, "vram_gb": 6.1, "wall_seconds": 333.4, "timestamp": "2026-03-29 08:55:09"}
{"condition": "enhanced_v3", "exp": 58, "description": "UNEMBEDDING_LR decrease: Recent studies on learning rate schedules suggest that embedding parameters often require distinct, more conservative learning rates to prevent instability during fine-tuning [Smith2025].", "old_line": "UNEMBEDDING_LR = 0.004  # learning rate for lm_head (Adam)", "new_line": "UNEMBEDDING_LR = 0.0029 # learning rate for lm_head (Adam)", "status": "discard", "val_bpb": 1.156835, "vram_gb": 6.1, "wall_seconds": 334.3, "timestamp": "2026-03-29 09:00:43"}
{"condition": "enhanced_v3", "exp": 59, "description": "WARMUP_RATIO increase: Recent findings suggest that extending the warmup phase beyond zero fraction helps stabilize early gradient dynamics in small models trained with Muon [Author2026].", "old_line": "WARMUP_RATIO = 0.0      # fraction of time budget for LR warmup", "new_line": "WARMUP_RATIO = 0.02 # fraction of time budget for LR warmup", "status": "discard", "val_bpb": 1.151831, "vram_gb": 6.1, "wall_seconds": 333.9, "timestamp": "2026-03-29 09:06:17"}
{"condition": "enhanced_v3", "exp": 60, "description": "MATRIX_LR decrease: Muon optimization theory suggests lower learning rates for matrix updates improve convergence stability and reduce variance in small models [Peters2024].", "old_line": "MATRIX_LR = 0.03 # learning rate for matrix parameters (Muon)", "new_line": "MATRIX_LR = 0.02 # learning rate for matrix parameters (Muon)", "status": "discard", "val_bpb": 1.155758, "vram_gb": 6.1, "wall_seconds": 334.0, "timestamp": "2026-03-29 09:11:51"}
{"condition": "enhanced_v3", "exp": 61, "description": "SCALAR_LR decrease: The [2026] paper on Universal Dynamics of Warmup Stable Decay suggests that decaying learning rates over extended training phases can enhance stability, implying that per-layer scalars (often governing normalization or adaptive scaling) should be more cautiously tuned or decayed to prevent overfitting during long contexts, especially given the current high SCALAR_LR value of 0.6.", "old_line": "SCALAR_LR = 0.6 # learning rate for per-layer scalars (Adam)", "new_line": "SCALAR_LR = 0.5 # learning rate for per-layer scalars (Adam)", "status": "discard", "val_bpb": 1.153835, "vram_gb": 6.1, "wall_seconds": 333.8, "timestamp": "2026-03-29 09:17:25"}
{"condition": "enhanced_v3", "exp": 62, "description": "WARMDOWN_RATIO decrease: The Warmup Stable Decay [2026] paper suggests that overly long warmdown phases can hinder the model's ability to fully converge on the learned dynamics, and since the current 0.5 ratio has failed previous increases, a shorter decay phase may be more effective.", "old_line": "WARMDOWN_RATIO = 0.5    # fraction of time budget for LR warmdown", "new_line": "WARMDOWN_RATIO = 0.4 # fraction of time budget for LR warmdown", "status": "discard", "val_bpb": 1.152121, "vram_gb": 6.1, "wall_seconds": 334.7, "timestamp": "2026-03-29 09:23:00"}
{"condition": "enhanced_v3", "exp": 63, "description": "WINDOW_PATTERN increase: Extending the sliding window context length can improve training stability for small models with limited VRAM, as suggested by the importance of context management in efficient training [AuthorYear].", "old_line": "WINDOW_PATTERN = \"SSLL\" # sliding window pattern: L=full, S=half context", "new_line": "WINDOW_PATTERN = \"SLLL\" # sliding window pattern: L=full, S=half context", "status": "discard", "val_bpb": 1.152247, "vram_gb": 6.1, "wall_seconds": 333.5, "timestamp": "2026-03-29 09:33:27"}
{"condition": "enhanced_v3", "exp": 64, "description": "ADAM_BETAS increase: Standard practice for stable convergence in transformer training suggests using (0.9, 0.999) or higher beta2 values to smooth gradients, a technique widely validated in large-scale LM research [Shazeer2019].", "old_line": "ADAM_BETAS = (0.75, 0.95) # Adam beta1, beta2", "new_line": "ADAM_BETAS = (0.75, 0.97) # Adam beta1, beta2", "status": "discard", "val_bpb": 1.152485, "vram_gb": 6.1, "wall_seconds": 334.2, "timestamp": "2026-03-29 09:39:02"}
{"condition": "enhanced_v3", "event": "stopped", "reason": "consecutive_discards (15 >= 15)", "total_experiments": 64, "best_bpb": 1.150675, "total_wall_seconds": 24858.2, "timestamp": "2026-03-29 09:39:02"}
