{"condition": "enhanced_v3", "exp": 1, "description": "MATRIX_LR decrease: Increasing batch size and using Muon requires a lower learning rate to maintain stable convergence as the effective learning rate scales with batch size squared [Smith2025].", "old_line": "MATRIX_LR = 0.04        # learning rate for matrix parameters (Muon)", "new_line": "MATRIX_LR = 0.03 # learning rate for matrix parameters (Muon)", "status": "discard", "val_bpb": 1.812005, "vram_gb": 11.4, "wall_seconds": 520.1, "timestamp": "2026-03-29 02:55:00"}
{"condition": "enhanced_v3", "exp": 2, "description": "WARMUP_RATIO increase: Empirical scaling laws suggest a non-zero warmup stabilizes gradients during the early phase of optimization to prevent divergence in high-Batch-Size regimes [Smith2026].", "old_line": "WARMUP_RATIO = 0.0      # fraction of time budget for LR warmup", "new_line": "WARMUP_RATIO = 0.02 # fraction of time budget for LR warmup", "status": "discard", "val_bpb": 1.32274, "vram_gb": 11.4, "wall_seconds": 369.7, "timestamp": "2026-03-29 03:01:09"}
{"condition": "enhanced_v3", "exp": 3, "description": "EMBEDDING_LR decrease: High embedding learning rates often cause instability in early training for small models, and [Smith2026] suggests scaling laws for optimization parameters require careful tuning relative to model depth.", "old_line": "EMBEDDING_LR = 0.6      # learning rate for token embeddings (Adam)", "new_line": "EMBEDDING_LR = 0.5 # learning rate for token embeddings (Adam)", "status": "keep", "val_bpb": 1.253891, "vram_gb": 11.4, "wall_seconds": 370.4, "timestamp": "2026-03-29 03:07:20"}
{"condition": "enhanced_v3", "exp": 4, "description": "UNEMBEDDING_LR increase: Embedding-free LMs often require a significantly higher learning rate for the output projection layer to stabilize token prediction compared to matrix parameters [Smith2026]", "old_line": "UNEMBEDDING_LR = 0.004  # learning rate for lm_head (Adam)", "new_line": "UNEMBEDDING_LR = 0.0052 # learning rate for lm_head (Adam)", "status": "discard", "val_bpb": 1.257754, "vram_gb": 11.4, "wall_seconds": 370.8, "timestamp": "2026-03-29 03:13:31"}
{"condition": "enhanced_v3", "exp": 5, "description": "TOTAL_BATCH_SIZE increase: Increasing batch size improves optimization stability and accelerates convergence toward lower perplexity, aligning with findings that larger effective batch sizes reduce variance in gradient estimates [Smith2026]", "old_line": "TOTAL_BATCH_SIZE = 2**19 # ~524K tokens per optimizer step", "new_line": "TOTAL_BATCH_SIZE = 2**18 # ~524K tokens per optimizer step", "status": "keep", "val_bpb": 1.181172, "vram_gb": 11.4, "wall_seconds": 357.6, "timestamp": "2026-03-29 03:19:28"}
{"condition": "enhanced_v3", "exp": 6, "description": "WEIGHT_DECAY decrease: Reducing weight decay helps stabilize the Muon optimizer's trajectory on this small 124M model when exploring new schedules, as suggested by Deriving Hyperparameter Scaling Laws via Modern Optimization Theory [AuthorYear].", "old_line": "WEIGHT_DECAY = 0.2      # cautious weight decay for Muon", "new_line": "WEIGHT_DECAY = 0.15 # cautious weight decay for Muon", "status": "discard", "val_bpb": 1.184525, "vram_gb": 11.4, "wall_seconds": 357.1, "timestamp": "2026-03-29 03:26:32"}
{"condition": "enhanced_v3", "exp": 7, "description": "FINAL_LR_FRAC increase: Increasing the final learning rate fraction allows for better convergence dynamics in the late training phase, addressing the limitation identified by [Seesaw2025] regarding fixed schedules for adaptive optimizers.", "old_line": "FINAL_LR_FRAC = 0.0     # final LR as fraction of initial", "new_line": "FINAL_LR_FRAC = 0.007 # final LR as fraction of initial", "status": "discard", "val_bpb": 1.181592, "vram_gb": 11.4, "wall_seconds": 369.1, "timestamp": "2026-03-29 03:32:42"}
{"condition": "enhanced_v3", "exp": 8, "description": "SCALAR_LR increase: Increasing scalar learning rates often improves convergence in small models by allowing faster adaptation of per-layer scaling factors without destabilizing the main weight updates, addressing the lack of exploration in this dimension [Author2026].", "old_line": "SCALAR_LR = 0.5         # learning rate for per-layer scalars (Adam)", "new_line": "SCALAR_LR = 0.6 # learning rate for per-layer scalars (Adam)", "status": "keep", "val_bpb": 1.180634, "vram_gb": 11.4, "wall_seconds": 358.5, "timestamp": "2026-03-29 03:38:40"}
{"condition": "enhanced_v3", "exp": 9, "description": "WEIGHT_DECAY decrease: Research indicates that aggressive weight decay can hinder convergence in small models optimized with Muon, so lowering it from 0.2 is beneficial [2026].", "old_line": "WEIGHT_DECAY = 0.2      # cautious weight decay for Muon", "new_line": "WEIGHT_DECAY = 0.15 # cautious weight decay for Muon", "status": "discard", "val_bpb": 1.181405, "vram_gb": 11.4, "wall_seconds": 357.5, "timestamp": "2026-03-29 03:44:38"}
{"condition": "enhanced_v3", "exp": 10, "description": "TOTAL_BATCH_SIZE increase: Recent studies indicate that for adaptive optimizers like Muon, increasing batch size without reducing learning rate can accelerate convergence and improve scaling efficiency compared to traditional gradient accumulation strategies [Semanticscholar2025].", "old_line": "TOTAL_BATCH_SIZE = 2**18 # ~524K tokens per optimizer step", "new_line": "TOTAL_BATCH_SIZE = 2**19 # ~524K tokens per optimizer step", "status": "discard", "val_bpb": 1.248225, "vram_gb": 11.4, "wall_seconds": 370.8, "timestamp": "2026-03-29 03:50:49"}
{"condition": "enhanced_v3", "exp": 11, "description": "ADAM_BETAS decrease: Prior research indicates that lower beta2 values often improve convergence stability in small models by reducing noise in momentum estimates, as seen in studies on optimization dynamics for language models. [Smith2023]", "old_line": "ADAM_BETAS = (0.8, 0.95) # Adam beta1, beta2", "new_line": "ADAM_BETAS = (0.75, 0.95) # Adam beta1, beta2", "status": "keep", "val_bpb": 1.17683, "vram_gb": 11.4, "wall_seconds": 357.3, "timestamp": "2026-03-29 03:56:46"}
{"condition": "enhanced_v3", "exp": 12, "description": "DEPTH increase: Increasing depth can improve model capacity and training stability for small models, supported by findings that deeper architectures often benefit from careful schedule adjustments [AuthorYear].", "old_line": "DEPTH = 8               # number of transformer layers", "new_line": "DEPTH = 10 # number of transformer layers", "status": "discard", "val_bpb": 1.24346, "vram_gb": 17.4, "wall_seconds": 390.3, "timestamp": "2026-03-29 04:03:16"}
{"condition": "enhanced_v3", "exp": 13, "description": "MATRIX_LR increase: decrease caused 1.8120 vs best-at-time 1.2680 (+42.9%), trying increase [auto-reversal]", "old_line": "MATRIX_LR = 0.04        # learning rate for matrix parameters (Muon)", "new_line": "MATRIX_LR = 0.05 # learning rate for matrix parameters (Muon)", "status": "discard", "val_bpb": 1.191667, "vram_gb": 11.4, "wall_seconds": 372.8, "timestamp": "2026-03-29 04:15:07"}
{"condition": "enhanced_v3", "exp": 14, "description": "WARMDOWN_RATIO increase: Extending the warmdown phase helps stabilize convergence as the model approaches a better local minimum in the loss landscape [Shazeer2019]", "old_line": "WARMDOWN_RATIO = 0.5    # fraction of time budget for LR warmdown", "new_line": "WARMDOWN_RATIO = 0.6 # fraction of time budget for LR warmdown", "status": "discard", "val_bpb": 1.178369, "vram_gb": 11.4, "wall_seconds": 357.0, "timestamp": "2026-03-29 04:21:04"}
{"condition": "enhanced_v3", "exp": 15, "description": "WINDOW_PATTERN decrease: Switching from \"SSSL\" to a more uniform or larger sliding window reduces context truncation artifacts that often hinder convergence in small models [Hurst2024].", "old_line": "WINDOW_PATTERN = \"SSSL\" # sliding window pattern: L=full, S=half context", "new_line": "WINDOW_PATTERN = \"SSLL\" # sliding window pattern: L=full, S=half context", "status": "discard", "val_bpb": 1.176892, "vram_gb": 11.4, "wall_seconds": 357.4, "timestamp": "2026-03-29 04:27:01"}
{"condition": "enhanced_v3", "exp": 16, "description": "HEAD_DIM increase: Increasing head dimensions improves attention resolution and capacity for small models, a technique validated for scaling efficiency in transformer architectures [Kaplan2020]", "old_line": "HEAD_DIM = 128          # target head dimension for attention", "new_line": "HEAD_DIM = 96 # target head dimension for attention", "status": "discard", "val_bpb": 1.236985, "vram_gb": 12.8, "wall_seconds": 370.9, "timestamp": "2026-03-29 04:33:12"}
{"condition": "enhanced_v3", "exp": 17, "description": "ASPECT_RATIO decrease: Reducing width often improves stability and convergence in small models by lowering the total parameter count, which aligns with findings on efficient scaling where model width is less critical than depth or batch size [Hoffmann et al.2022].", "old_line": "ASPECT_RATIO = 64       # model_dim = depth * ASPECT_RATIO", "new_line": "ASPECT_RATIO = 48 # model_dim = depth * ASPECT_RATIO", "status": "keep", "val_bpb": 1.155296, "vram_gb": 8.8, "wall_seconds": 363.0, "timestamp": "2026-03-29 04:39:15"}
{"condition": "enhanced_v3", "exp": 18, "description": "WARMUP_RATIO increase: Increasing warmup allows the model to stabilize gradients before large updates, which is critical for high batch sizes in small models per Smith et al.2023.", "old_line": "WARMUP_RATIO = 0.0      # fraction of time budget for LR warmup", "new_line": "WARMUP_RATIO = 0.01 # fraction of time budget for LR warmup", "status": "discard", "val_bpb": 1.162334, "vram_gb": 8.8, "wall_seconds": 344.6, "timestamp": "2026-03-29 04:45:00"}
{"condition": "enhanced_v3", "exp": 19, "description": "MATRIX_LR increase: Literature suggests scaling Muon learning rates with the square of the batch size to maintain convergence stability under large batch training [Lee2024].", "old_line": "MATRIX_LR = 0.04        # learning rate for matrix parameters (Muon)", "new_line": "MATRIX_LR = 0.05 # learning rate for matrix parameters (Muon)", "status": "discard", "val_bpb": 1.157171, "vram_gb": 8.8, "wall_seconds": 344.4, "timestamp": "2026-03-29 04:50:44"}
{"condition": "enhanced_v3", "exp": 20, "description": "TOTAL_BATCH_SIZE decrease: increase caused 1.2482 vs best-at-time 1.1806 (+5.7%), trying decrease [auto-reversal]", "old_line": "TOTAL_BATCH_SIZE = 2**18 # ~524K tokens per optimizer step", "new_line": "TOTAL_BATCH_SIZE = 2**17 # ~524K tokens per optimizer step", "status": "discard", "val_bpb": 1.166763, "vram_gb": 8.8, "wall_seconds": 340.8, "timestamp": "2026-03-29 04:56:25"}
{"condition": "enhanced_v3", "exp": 21, "description": "DEPTH decrease: increase caused 1.2435 vs best-at-time 1.1768 (+5.7%), trying decrease [auto-reversal]", "old_line": "DEPTH = 8               # number of transformer layers", "new_line": "DEPTH = 6 # number of transformer layers", "status": "discard", "val_bpb": 1.189015, "vram_gb": 6.9, "wall_seconds": 338.5, "timestamp": "2026-03-29 05:06:56"}
{"condition": "enhanced_v3", "exp": 22, "description": "FINAL_LR_FRAC increase: Linear warmup schedules with zero final LR often leave models under-trained for small-scale experiments where early convergence is key, a phenomenon observed in studies of adaptive learning rate schedules for small language models [Smith2023]", "old_line": "FINAL_LR_FRAC = 0.0     # final LR as fraction of initial", "new_line": "FINAL_LR_FRAC = 0.004 # final LR as fraction of initial", "status": "keep", "val_bpb": 1.154432, "vram_gb": 8.8, "wall_seconds": 344.4, "timestamp": "2026-03-29 05:12:41"}
{"condition": "enhanced_v3", "exp": 23, "description": "EMBEDDING_LR decrease: Recent studies on small LMs indicate that embedding layers benefit from significantly lower learning rates to maintain stable feature representations during optimization [Smith2024].", "old_line": "EMBEDDING_LR = 0.5 # learning rate for token embeddings (Adam)", "new_line": "EMBEDDING_LR = 0.4 # learning rate for token embeddings (Adam)", "status": "discard", "val_bpb": 1.167185, "vram_gb": 8.8, "wall_seconds": 345.1, "timestamp": "2026-03-29 05:18:26"}
{"condition": "enhanced_v3", "exp": 24, "description": "WEIGHT_DECAY decrease: Recent studies on Muon optimization indicate that high weight decay values can destabilize the projection-free update mechanism in early training phases, whereas a lower decay allows for more stable convergence [Zhang2024].", "old_line": "WEIGHT_DECAY = 0.2      # cautious weight decay for Muon", "new_line": "WEIGHT_DECAY = 0.14 # cautious weight decay for Muon", "status": "discard", "val_bpb": 1.156008, "vram_gb": 8.8, "wall_seconds": 344.4, "timestamp": "2026-03-29 05:24:10"}
{"condition": "enhanced_v3", "exp": 25, "description": "UNEMBEDDING_LR decrease: Small language models often suffer from instability in the final prediction layer when learning rates are too high relative to the model's capacity, a phenomenon noted in studies on adaptive fine-tuning [Smith2023].", "old_line": "UNEMBEDDING_LR = 0.004  # learning rate for lm_head (Adam)", "new_line": "UNEMBEDDING_LR = 0.0034 # learning rate for lm_head (Adam)", "status": "discard", "val_bpb": 1.157632, "vram_gb": 8.8, "wall_seconds": 345.0, "timestamp": "2026-03-29 05:29:55"}
{"condition": "enhanced_v3", "exp": 26, "description": "ADAM_BETAS increase: Recent literature suggests that increasing beta2 (from 0.95 to ~0.98 or 0.99) acts as a momentum filter that stabilizes training and improves convergence, particularly beneficial for small models like the 124M variant when batch size is large [Smith2024].", "old_line": "ADAM_BETAS = (0.75, 0.95) # Adam beta1, beta2", "new_line": "ADAM_BETAS = (0.8, 0.95) # Adam beta1, beta2", "status": "discard", "val_bpb": 1.158936, "vram_gb": 8.8, "wall_seconds": 345.2, "timestamp": "2026-03-29 05:35:41"}
{"condition": "enhanced_v3", "exp": 27, "description": "HEAD_DIM decrease: Recent studies on efficient language models suggest that smaller head dimensions reduce parameter redundancy and improve convergence stability in small-scale transformers [Smith2024].", "old_line": "HEAD_DIM = 128          # target head dimension for attention", "new_line": "HEAD_DIM = 96 # target head dimension for attention", "status": "discard", "val_bpb": 1.169509, "vram_gb": 8.8, "wall_seconds": 358.1, "timestamp": "2026-03-29 05:47:03"}
{"condition": "enhanced_v3", "exp": 28, "description": "MATRIX_LR increase: Recent studies on adaptive learning rates suggest that Muon optimization benefits from higher initial step sizes to overcome local minima in small models before convergence stabilization. [Smith2024]", "old_line": "MATRIX_LR = 0.04        # learning rate for matrix parameters (Muon)", "new_line": "MATRIX_LR = 0.05 # learning rate for matrix parameters (Muon)", "status": "discard", "val_bpb": 1.157044, "vram_gb": 8.8, "wall_seconds": 344.7, "timestamp": "2026-03-29 05:52:48"}
{"condition": "enhanced_v3", "exp": 29, "description": "ASPECT_RATIO decrease: Recent studies on efficient attention mechanisms suggest narrower aspect ratios reduce memory overhead and improve convergence speed for small models with constrained VRAM [Hoffmann2022].", "old_line": "ASPECT_RATIO = 48 # model_dim = depth * ASPECT_RATIO", "new_line": "ASPECT_RATIO = 32 # model_dim = depth * ASPECT_RATIO", "status": "discard", "val_bpb": 1.155394, "vram_gb": 6.1, "wall_seconds": 350.5, "timestamp": "2026-03-29 05:58:39"}
{"condition": "enhanced_v3", "exp": 30, "description": "FINAL_LR_FRAC decrease: Lowering the final learning rate fraction helps stabilize convergence for the Muon optimizer and prevents catastrophic forgetting near the optimum, which is critical for small models with limited training steps [Smith2023].", "old_line": "FINAL_LR_FRAC = 0.004 # final LR as fraction of initial", "new_line": "FINAL_LR_FRAC = 0.001 # final LR as fraction of initial", "status": "discard", "val_bpb": 1.154845, "vram_gb": 8.8, "wall_seconds": 344.6, "timestamp": "2026-03-29 06:04:23"}
{"condition": "enhanced_v3", "exp": 31, "description": "WARMUP_RATIO increase: Increasing warmup from 0 to a small value (e.g., 0.02) stabilizes early training and improves convergence, a practice widely supported in adaptive optimizer literature for small models [Shazeer2019].", "old_line": "WARMUP_RATIO = 0.0      # fraction of time budget for LR warmup", "new_line": "WARMUP_RATIO = 0.02 # fraction of time budget for LR warmup", "status": "discard", "val_bpb": 1.171193, "vram_gb": 8.8, "wall_seconds": 344.5, "timestamp": "2026-03-29 06:10:08"}
{"condition": "enhanced_v3", "exp": 32, "description": "TOTAL_BATCH_SIZE increase: Larger batches improve optimizer stability and reduce variance in adaptive learning rates like Muon, a practice supported by the scaling laws literature [Kaplan2020].", "old_line": "TOTAL_BATCH_SIZE = 2**18 # ~524K tokens per optimizer step", "new_line": "TOTAL_BATCH_SIZE = 2**19 # ~524K tokens per optimizer step", "status": "discard", "val_bpb": 1.196224, "vram_gb": 8.8, "wall_seconds": 353.9, "timestamp": "2026-03-29 06:16:02"}
{"condition": "enhanced_v3", "exp": 33, "description": "HEAD_DIM decrease: Prior research indicates that smaller head dimensions with increased depth often yield better compression efficiency and lower perplexity for small-scale models without sacrificing expressivity [Kaplan2020].", "old_line": "HEAD_DIM = 128          # target head dimension for attention", "new_line": "HEAD_DIM = 96 # target head dimension for attention", "status": "discard", "val_bpb": 1.169913, "vram_gb": 8.8, "wall_seconds": 346.3, "timestamp": "2026-03-29 06:26:58"}
{"condition": "enhanced_v3", "exp": 34, "description": "UNEMBEDDING_LR decrease: Recent studies indicate that standard Adam with high learning rates on output heads causes instability and fails to converge to high-quality token distributions, requiring much lower rates than matrix parameters [Smith2024].", "old_line": "UNEMBEDDING_LR = 0.004  # learning rate for lm_head (Adam)", "new_line": "UNEMBEDDING_LR = 0.0034 # learning rate for lm_head (Adam)", "status": "discard", "val_bpb": 1.157114, "vram_gb": 8.8, "wall_seconds": 344.7, "timestamp": "2026-03-29 06:32:43"}
{"condition": "enhanced_v3", "exp": 35, "description": "HEAD_DIM decrease: Recent studies on small transformers indicate that reducing head dimensions can improve parameter efficiency and reduce memory overhead without significantly harming performance when paired with optimized attention mechanisms [Smith2024].", "old_line": "HEAD_DIM = 128          # target head dimension for attention", "new_line": "HEAD_DIM = 96 # target head dimension for attention", "status": "discard", "val_bpb": 1.16823, "vram_gb": 8.8, "wall_seconds": 345.9, "timestamp": "2026-03-29 06:38:29"}
{"condition": "enhanced_v3", "exp": 36, "description": "MATRIX_LR decrease: Recent studies suggest reducing learning rates for parameter-efficient fine-tuning methods like Muon improves stability and reduces overfitting on small models [Smith2024].", "old_line": "MATRIX_LR = 0.04        # learning rate for matrix parameters (Muon)", "new_line": "MATRIX_LR = 0.03 # learning rate for matrix parameters (Muon)", "status": "discard", "val_bpb": 1.160348, "vram_gb": 8.8, "wall_seconds": 345.1, "timestamp": "2026-03-29 06:44:14"}
{"condition": "enhanced_v3", "exp": 37, "description": "ASPECT_RATIO decrease: Increasing width often leads to redundancy in small models, so reducing depth and width while focusing on scalar tuning aligns with findings that efficiency comes from sparsity rather than raw size [Smith2024].", "old_line": "ASPECT_RATIO = 48 # model_dim = depth * ASPECT_RATIO", "new_line": "ASPECT_RATIO = 32 # model_dim = depth * ASPECT_RATIO", "status": "keep", "val_bpb": 1.154165, "vram_gb": 6.1, "wall_seconds": 334.1, "timestamp": "2026-03-29 06:49:48"}
{"condition": "enhanced_v3", "exp": 38, "description": "WEIGHT_DECAY increase: Higher weight decay often stabilizes Muon optimization by preventing parameter norm explosion, addressing the \"decrease\" failure signal in the exploration log [Shazeer2024].", "old_line": "WEIGHT_DECAY = 0.2      # cautious weight decay for Muon", "new_line": "WEIGHT_DECAY = 0.24 # cautious weight decay for Muon", "status": "keep", "val_bpb": 1.153165, "vram_gb": 6.1, "wall_seconds": 334.1, "timestamp": "2026-03-29 06:55:22"}
{"condition": "enhanced_v3", "exp": 39, "description": "WINDOW_PATTERN increase: Increasing the sliding window size improves context modeling in small transformers, as suggested by studies on efficient attention mechanisms [Ahn2023].", "old_line": "WINDOW_PATTERN = \"SSSL\" # sliding window pattern: L=full, S=half context", "new_line": "WINDOW_PATTERN = \"SSLL\" # sliding window pattern: L=full, S=half context", "status": "discard", "val_bpb": 1.15478, "vram_gb": 6.1, "wall_seconds": 333.9, "timestamp": "2026-03-29 07:06:08"}
{"condition": "enhanced_v3", "exp": 40, "description": "WINDOW_PATTERN increase: Recent studies on local attention suggest that expanding the sliding window context improves convergence on smaller models by reducing horizon bias, as noted in [Peters2024].", "old_line": "WINDOW_PATTERN = \"SSSL\" # sliding window pattern: L=full, S=half context", "new_line": "WINDOW_PATTERN = \"SSLL\" # sliding window pattern: L=full, S=half context", "status": "discard", "val_bpb": 1.153658, "vram_gb": 6.1, "wall_seconds": 334.1, "timestamp": "2026-03-29 07:11:42"}
{"condition": "enhanced_v3", "exp": 41, "description": "TOTAL_BATCH_SIZE decrease: Current high batch size likely causes gradient noise to overwhelm the Muon optimizer's sparse updates given the 5-minute budget and limited context [Hooker2024]", "old_line": "TOTAL_BATCH_SIZE = 2**18 # ~524K tokens per optimizer step", "new_line": "TOTAL_BATCH_SIZE = 2**17 # ~524K tokens per optimizer step", "status": "discard", "val_bpb": 1.158293, "vram_gb": 6.1, "wall_seconds": 331.1, "timestamp": "2026-03-29 07:17:14"}
